{"analysis_audit_id":"019c1234-0000-7000-8000-000000000004","analysis_input_id":null,"analysis_output_id":null,"contract_versions":{"input":"ai_analysis_input.v1","output":"ai_analysis_output.v1","policy":"ai_analysis_policy.v1"},"evidence_digest":"5812763f13238fe7258a5a8eaeda96da13ecbf87d7ee4d1f644929fdbb3d87d1","generator":null,"outcome":"refused","purpose":"market_snapshot_explanation","reason_code":"snapshot_stale","recorded_at":"2026-07-26T12:00:03.000000Z","schema_version":"ai_analysis_audit.v1","snapshot_id":"019849d1-8c00-7000-8000-000000000004"}
