{"analysis_audit_id":"019c1234-0000-7000-8000-000000000003","analysis_input_id":"019c1234-0000-7000-8000-000000000001","analysis_output_id":"019c1234-0000-7000-8000-000000000002","contract_versions":{"input":"ai_analysis_input.v1","output":"ai_analysis_output.v1","policy":"ai_analysis_policy.v1"},"evidence_digest":"28bf3b99c953c94eaa5ca5b9f8d48c83b495445cd327f0be61ee5c60eee81c6c","generator":{"model_id":"synthetic-model-v1","provider_id":"synthetic-provider"},"outcome":"completed","purpose":"strategy_explanation","reason_code":null,"recorded_at":"2026-07-26T12:00:02.000000Z","schema_version":"ai_analysis_audit.v1","snapshot_id":"019849d1-8c00-7000-8000-000000000001"}
